{
  "profile": {
    "name": "mfj-dublin-merch",
    "source": "cloudflare-worker",
    "site": "marchforjesus.ie",
    "microsoftTenant": "allnations.ie"
  },
  "order": {
    "id": "00000000-0000-4000-8000-000000000001",
    "reservation_id": "00000000-0000-4000-8000-000000000002",
    "stripe_checkout_session_id": "cs_test_example",
    "stripe_payment_intent_id": "pi_test_example",
    "customer_name": "Example Customer",
    "customer_email": "customer@example.com",
    "amount_total": 4000,
    "currency": "gbp",
    "payment_status": "paid",
    "collection_status": "not_collected",
    "confirmation_email_status": "sent",
    "confirmation_email_error": null,
    "confirmation_email_sent_at": 1770000010,
    "microsoft_sync_status": "pending",
    "created_at": 1770000000
  },
  "lines": [
    {
      "order_id": "00000000-0000-4000-8000-000000000001",
      "variant_id": "mfj-logo-tshirt-burgundy-m",
      "product_name": "MFJ Logo T-shirt",
      "colour": "Burgundy",
      "size": "M",
      "quantity": 2,
      "unit_amount": 2000,
      "total_amount": 4000
    }
  ],
  "totals": {
    "itemCount": 2,
    "amountTotal": 4000,
    "currency": "gbp"
  },
  "milestonesCrossed": [
    10
  ]
}
